{
  "contract_version": "1.0.0",
  "intake_id": "intake-2026-08-27-12factor-processes",
  "insight_id": "twelve-factor-stateless-process-boundary",
  "knowledge_delta": {
    "insight_id": "twelve-factor-stateless-process-boundary",
    "summary": "Twelve-Factor adds a process-lifetime boundary rather than another workflow runtime: compute processes are disposable, durable correctness state belongs in backing services, and local memory/files are acceptable only when their loss is safe.",
    "items": [
      {"relationship": "new", "concept_id": "stateless-process", "label": "Stateless process", "source_basis": "The source states that twelve-factor processes are stateless/share-nothing and cannot assume future requests or jobs return to the same process.", "prior_basis": "The graph had implementation-specific Worker and Workflow concepts but no generic disposable-process runtime boundary.", "interpretation": "Stateless process becomes a reusable architecture concept about process lifetime, independent of any one orchestration technology.", "evidence_insights": []},
      {"relationship": "new", "concept_id": "backing-service-state", "label": "Backing-service state", "source_basis": "Any data that must persist is stored in a stateful backing service rather than process memory or local filesystem.", "prior_basis": "No prior concept explicitly represented the application-level rule that durable correctness state must survive outside disposable compute processes.", "interpretation": "The application can remain stateful while compute stays replaceable because persistence has an explicit external owner.", "evidence_insights": []},
      {"relationship": "new", "concept_id": "ephemeral-process-state", "label": "Ephemeral process state", "source_basis": "Memory and local filesystem may be used as brief single-transaction cache but must not be required by future requests/jobs.", "prior_basis": "The existing graph did not distinguish safe temporary process-local working data from durable application state.", "interpretation": "This avoids the overcorrection that stateless architecture forbids all local state; the real test is whether losing it breaks correctness.", "evidence_insights": []}
    ],
    "suppressed_prior_matches": ["durable-execution", "worker-process", "workflow-execution", "controlled-execution", "activity-execution"]
  },
  "claim_evidence": {
    "insight_id": "twelve-factor-stateless-process-boundary",
    "claims": [
      {"id": "twelve-factor-stateless-share-nothing", "text": "Twelve-factor application processes are stateless and share-nothing, so correctness must not depend on hidden state retained inside one process instance across requests or jobs.", "impact": "high", "origin": "source", "status": "supported", "evidence": [{"kind": "primary_source", "source_id": "src-twelve-factor-processes-2017", "url": "https://12factor.net/processes", "locator": "VI. Processes → stateless and share-nothing processes"}], "note": null},
      {"id": "twelve-factor-persist-backing-service", "text": "Data that must persist beyond the current process work unit belongs in a stateful backing service rather than only in process memory or local filesystem.", "impact": "high", "origin": "source", "status": "supported", "evidence": [{"kind": "primary_source", "source_id": "src-twelve-factor-processes-2017", "url": "https://12factor.net/processes", "locator": "VI. Processes → persistent data in a stateful backing service"}], "note": null},
      {"id": "twelve-factor-local-cache-disposable", "text": "Process memory or filesystem may be used as brief temporary cache only when future requests or jobs do not depend on that local state surviving restart, relocation or process replacement.", "impact": "medium", "origin": "source", "status": "supported", "evidence": [{"kind": "primary_source", "source_id": "src-twelve-factor-processes-2017", "url": "https://12factor.net/processes", "locator": "VI. Processes → memory/filesystem as brief single-transaction cache"}], "note": null},
      {"id": "twelve-factor-not-durable-workflow-runtime", "text": "The stateless-process principle is compatible with durable workflows when orchestration state lives outside disposable workers, but the Twelve-Factor source itself does not define a durable workflow execution mechanism.", "impact": "high", "origin": "project_interpretation", "status": "supported", "evidence": [{"kind": "primary_source", "source_id": "src-twelve-factor-processes-2017", "url": "https://12factor.net/processes", "locator": "VI. Processes → stateless/share-nothing and persistent backing-service state"}, {"kind": "prior_insight", "insight_id": "temporal-durable-execution-mental-model", "locator": "Durable Workflow Execution state outside replaceable Worker Processes"}], "note": "The source establishes disposable process-local state; compatibility with Temporal-style external durable workflow state is project synthesis and should not be read as a source claim."}
    ]
  },
  "prerequisite_map": {
    "insight_id": "twelve-factor-stateless-process-boundary",
    "summary": "The model needs only three pieces: a disposable stateless process, a backing service that owns persistent state, and an explicit category of ephemeral local working data whose loss is safe.",
    "items": [
      {"id": "twelve-factor-prereq-process", "label": "Stateless process", "concept_id": "stateless-process", "priority": "must_know_now", "prior_coverage": "absent", "state": "explained_here", "reason": "The factor is fundamentally about making process instances disposable across requests, jobs, restarts and scaling.", "resolution": {"kind": "explained_here", "insight_id": "twelve-factor-stateless-process-boundary", "target": null}},
      {"id": "twelve-factor-prereq-backing-state", "label": "Backing-service state", "concept_id": "backing-service-state", "priority": "must_know_now", "prior_coverage": "absent", "state": "explained_here", "reason": "Without external persistent state, 'stateless process' is easily misread as an application with no durable state at all.", "resolution": {"kind": "explained_here", "insight_id": "twelve-factor-stateless-process-boundary", "target": null}},
      {"id": "twelve-factor-prereq-ephemeral", "label": "Ephemeral process state", "concept_id": "ephemeral-process-state", "priority": "must_know_now", "prior_coverage": "absent", "state": "explained_here", "reason": "The source explicitly allows process-local cache when losing it is safe, which defines the practical boundary rather than a blanket ban on local state.", "resolution": {"kind": "explained_here", "insight_id": "twelve-factor-stateless-process-boundary", "target": null}}
    ]
  },
  "learning_prompt": {
    "insight_id": "twelve-factor-stateless-process-boundary",
    "retention_prompt": "Without looking back, reconstruct the Twelve-Factor process boundary: explain why future requests/jobs cannot rely on one process instance, where persistent application state belongs, what process-local state is still allowed, and why this does not mean the whole application is stateless.",
    "answer_key": {"problem_from": "whole_source_map.problem", "mechanism_from": "whole_source_map.thesis", "anchor_concept_ids": ["stateless-process", "backing-service-state", "ephemeral-process-state"], "boundary_limitation_index": 0},
    "transfer_prompt": {"prompt": "A service is scaled to five interchangeable instances and a multi-step job may resume after a restart. Decide which data can remain local, which state must move to an external durable service, and what property makes an instance genuinely disposable.", "expected_concept_ids": ["stateless-process", "backing-service-state", "ephemeral-process-state"]}
  },
  "source_decision": {
    "insight_id": "twelve-factor-stateless-process-boundary",
    "decision": "explainer_is_enough",
    "rationale": "The original Processes page is very short and the explainer preserves its complete conceptual argument: stateless/share-nothing processes, persistent backing-service state, disposable local cache, restart boundaries and the sticky-session warning. Reopening the source adds little unless the canonical wording itself is needed.",
    "novelty": {"level": "high", "reason": "The source adds a generic runtime-process disposability model rather than another implementation-specific workflow or worker concept."},
    "source_quality": {"level": "high", "reason": "The primary source is the canonical Twelve-Factor Processes page authored by Adam Wiggins and fully inspected."},
    "relevance": {"level": "high", "reason": "The process/state boundary remains directly useful for horizontally scaled services, background workers and containerized deployments."},
    "practical_leverage": {"level": "high", "reason": "The model gives a concrete review test: if losing one process breaks future correctness, durable state has been placed at the wrong lifetime boundary."},
    "compression_loss": {"level": "low", "reason": "The source itself is compact and contains no large implementation sections that must be preserved for the requested mental model."},
    "selected_parts": []
  }
}
