{
  "contract_version": "1.0.0",
  "intake_id": "intake-2026-08-27-sqlite-wal-html",
  "insight_id": "sqlite-write-ahead-log-checkpointing",
  "knowledge_delta": {
    "insight_id": "sqlite-write-ahead-log-checkpointing",
    "summary": "SQLite WAL opens a new database-storage branch: append-first commit, checkpointing and reader snapshot boundaries. All retrieved execution/audit-history matches are suppressed because shared log vocabulary does not imply the same mechanism or purpose.",
    "items": [
      {"relationship": "new", "concept_id": "write-ahead-log", "label": "Write-ahead log", "source_basis": "SQLite preserves the database file during commit and appends changed pages plus a commit record to a separate WAL.", "prior_basis": "The project graph had execution and workflow histories but no transactional database write-ahead-log concept.", "interpretation": "The log is a storage/commit mechanism that separates foreground append from later consolidation, not a business audit record.", "evidence_insights": []},
      {"relationship": "new", "concept_id": "checkpointing", "label": "Checkpointing", "source_basis": "SQLite later transfers committed WAL content into the database through a distinct checkpoint operation that can pause behind active readers.", "prior_basis": "No earlier concept represented WAL-to-database consolidation as a separate maintenance phase.", "interpretation": "Checkpointing makes the cost shift explicit: fast append-oriented commits still require later consolidation and coordination with readers.", "evidence_insights": []},
      {"relationship": "new", "concept_id": "wal-reader-snapshot", "label": "WAL reader snapshot", "source_basis": "Each read transaction fixes an end mark and ignores newer WAL commits for the duration of that transaction.", "prior_basis": "Existing graph concepts did not model SQLite's point-in-time reader boundary over a concurrently growing WAL.", "interpretation": "The end mark explains why a reader can stay stable while a writer continues to append new commits.", "evidence_insights": []}
    ],
    "suppressed_prior_matches": ["execution-history", "event-history", "controlled-execution", "replayable-evaluation"]
  },
  "claim_evidence": {
    "insight_id": "sqlite-write-ahead-log-checkpointing",
    "claims": [
      {"id": "sqlite-wal-append-commit", "text": "In SQLite WAL mode, changes are appended to a separate WAL and a transaction commits when a commit record is appended, without requiring the original database file to be updated at that moment.", "impact": "high", "origin": "source", "status": "supported", "evidence": [{"kind": "primary_source", "source_id": "src-sqlite-wal-docs-2026", "url": "https://www.sqlite.org/wal.html", "locator": "Write-Ahead Logging → How WAL Works"}], "note": null},
      {"id": "sqlite-wal-reader-concurrency", "text": "A WAL reader keeps a fixed end mark for its transaction, allowing readers to coexist with an appending writer, while SQLite still permits only one writer at a time.", "impact": "high", "origin": "source", "status": "supported", "evidence": [{"kind": "primary_source", "source_id": "src-sqlite-wal-docs-2026", "url": "https://www.sqlite.org/wal.html", "locator": "Write-Ahead Logging → Concurrency"}], "note": null},
      {"id": "sqlite-wal-checkpoint-starvation", "text": "Checkpointing copies committed WAL pages back into the database but can be prevented from completing by long-running or continuously overlapping readers, causing the WAL to keep growing.", "impact": "high", "origin": "source", "status": "supported", "evidence": [{"kind": "primary_source", "source_id": "src-sqlite-wal-docs-2026", "url": "https://www.sqlite.org/wal.html", "locator": "Write-Ahead Logging → Checkpointing; Avoiding Excessively Large WAL Files"}], "note": null},
      {"id": "sqlite-wal-not-execution-history", "text": "SQLite WAL should not be treated as the same concept as an application execution history or Temporal Event History merely because all are log-like records; WAL is database commit and recovery machinery with different evidence semantics.", "impact": "high", "origin": "project_interpretation", "status": "supported", "evidence": [{"kind": "primary_source", "source_id": "src-sqlite-wal-docs-2026", "url": "https://www.sqlite.org/wal.html", "locator": "Write-Ahead Logging → How WAL Works and WAL File"}, {"kind": "prior_insight", "insight_id": "enterprise-agents-production-substrate", "locator": "Execution history as reconstructable evidence of consequential work"}, {"kind": "prior_insight", "insight_id": "temporal-durable-execution-mental-model", "locator": "Temporal Event History as persisted workflow execution progress"}], "note": "This is a project-level scope comparison used to reject lexical retrieval noise; the SQLite source itself does not discuss the project's execution-history concepts."}
    ]
  },
  "prerequisite_map": {
    "insight_id": "sqlite-write-ahead-log-checkpointing",
    "summary": "Three concepts are sufficient for the first mental model: append-first WAL commit, checkpointing as a separate consolidation step, and the reader end-mark snapshot that makes concurrent reads understandable.",
    "items": [
      {"id": "sqlite-wal-prereq-log", "label": "Write-ahead log", "concept_id": "write-ahead-log", "priority": "must_know_now", "prior_coverage": "absent", "state": "explained_here", "reason": "The inversion from overwriting the database to appending committed changes is the central storage mechanism.", "resolution": {"kind": "explained_here", "insight_id": "sqlite-write-ahead-log-checkpointing", "target": null}},
      {"id": "sqlite-wal-prereq-checkpoint", "label": "Checkpointing", "concept_id": "checkpointing", "priority": "must_know_now", "prior_coverage": "absent", "state": "explained_here", "reason": "The model is incomplete if append-only commit is understood without the later operation that consolidates WAL pages into the database.", "resolution": {"kind": "explained_here", "insight_id": "sqlite-write-ahead-log-checkpointing", "target": null}},
      {"id": "sqlite-wal-prereq-snapshot", "label": "WAL reader snapshot", "concept_id": "wal-reader-snapshot", "priority": "must_know_now", "prior_coverage": "absent", "state": "explained_here", "reason": "The reader end mark is what makes stable reads alongside newer appended commits coherent.", "resolution": {"kind": "explained_here", "insight_id": "sqlite-write-ahead-log-checkpointing", "target": null}}
    ]
  },
  "learning_prompt": {
    "insight_id": "sqlite-write-ahead-log-checkpointing",
    "retention_prompt": "Without looking back, reconstruct SQLite WAL as a three-part model: explain where a write commits before the database file is updated, how a reader's end mark gives it a stable view, what checkpointing does later, and one way active readers can turn that separation into an operational problem.",
    "answer_key": {"problem_from": "whole_source_map.problem", "mechanism_from": "whole_source_map.thesis", "anchor_concept_ids": ["write-ahead-log", "checkpointing", "wal-reader-snapshot"], "boundary_limitation_index": 2},
    "transfer_prompt": {"prompt": "An embedded service has frequent small writes and some long analytical reads. If you switch it to SQLite WAL, explain which foreground work becomes cheaper, what snapshot behavior readers get, and what checkpoint/WAL-growth failure mode you would monitor.", "expected_concept_ids": ["write-ahead-log", "checkpointing", "wal-reader-snapshot"]}
  },
  "source_decision": {
    "insight_id": "sqlite-write-ahead-log-checkpointing",
    "decision": "skim_selected_parts",
    "rationale": "The explainer is enough for the core mental model, but the official SQLite page contains implementation and operational details that matter before real tuning. Skim the mechanism, concurrency and checkpoint-starvation sections when adopting WAL or diagnosing a concrete workload.",
    "novelty": {"level": "high", "reason": "The source creates a new database-storage branch; apparent links to execution history were retrieval noise rather than prior coverage."},
    "source_quality": {"level": "high", "reason": "The source is the official SQLite WAL documentation and directly defines the implementation semantics being explained."},
    "relevance": {"level": "medium", "reason": "The mechanism is highly reusable for understanding embedded-database concurrency, but it is less broadly applicable than the retry or reconciliation patterns."},
    "practical_leverage": {"level": "high", "reason": "Knowing the end-mark and checkpoint model changes how WAL growth, long readers, commit latency and durability settings are diagnosed."},
    "compression_loss": {"level": "medium", "reason": "The explainer intentionally omits WAL format, checkpoint modes, configuration APIs and several edge cases that become relevant during production tuning."},
    "selected_parts": [
      {"label": "How WAL Works", "locator": "Write-Ahead Logging → How WAL Works", "why": "Confirms the append-first commit inversion and commit-record boundary.", "claim_refs": ["sqlite-wal-append-commit"]},
      {"label": "Concurrency", "locator": "Write-Ahead Logging → Concurrency", "why": "Shows reader end marks, WAL page lookup, reader/writer coexistence and the one-writer limit.", "claim_refs": ["sqlite-wal-reader-concurrency"]},
      {"label": "Checkpoint starvation", "locator": "Write-Ahead Logging → Checkpointing; Avoiding Excessively Large WAL Files", "why": "Explains why overlapping long reads can prevent WAL reset and create file growth/performance problems.", "claim_refs": ["sqlite-wal-checkpoint-starvation"]}
    ]
  }
}
