{
  "contract_version": "1.0.0",
  "intake_id": "intake-2026-08-27-github-duckdb",
  "insight_id": "duckdb-in-process-analytics",
  "knowledge_delta": {
    "insight_id": "duckdb-in-process-analytics",
    "summary": "DuckDB adds a deployment/composition concept that was missing from the graph: analytical SQL can live inside the host process. The automatically retrieved execution/workflow concepts are rejected as unrelated rather than forced into the new source.",
    "items": [
      {"relationship": "new", "concept_id": "in-process-analytical-database", "label": "In-process analytical database", "source_basis": "DuckDB explicitly describes itself as an analytical in-process database system and exposes native clients that run the engine with the host application.", "prior_basis": "Existing graph knowledge covers workflow execution, reconciliation and database concurrency, but not the deployment boundary where an analytical database is embedded directly in a host process.", "interpretation": "The architectural leverage is a composition change: SQL becomes a library/runtime capability rather than necessarily a network service.", "evidence_insights": []},
      {"relationship": "new", "concept_id": "embedded-query-engine", "label": "Embedded query engine", "source_basis": "Native client APIs let application code invoke DuckDB directly without provisioning a separate database server for the embedded use case.", "prior_basis": "No prior concept represented query execution as an application-local capability independent of a shared database-service boundary.", "interpretation": "This makes it reasonable to design local utilities around an embedded engine first and add a service boundary only when sharing, lifecycle or governance requirements justify it.", "evidence_insights": []},
      {"relationship": "new", "concept_id": "direct-file-querying", "label": "Direct file querying", "source_basis": "The DuckDB repository demonstrates SQL directly over CSV and Parquet files.", "prior_basis": "Earlier data concepts focus on concurrency/storage behavior rather than removing an explicit load-to-database step for analytical files.", "interpretation": "For many local pipelines, file data can remain the input artifact while SQL becomes the transformation interface, reducing an intermediate ingestion step.", "evidence_insights": []}
    ],
    "suppressed_prior_matches": ["protected-data-separation", "worker-process", "controlled-execution", "activity-execution", "task-queue"]
  },
  "claim_evidence": {
    "insight_id": "duckdb-in-process-analytics",
    "claims": [
      {"id": "duckdb-in-process-positioning", "text": "DuckDB is designed as an analytical in-process SQL database system and can be embedded through native language clients.", "impact": "high", "origin": "source", "status": "supported", "evidence": [{"kind": "primary_source", "source_id": "src-duckdb-repository-2026", "url": "https://github.com/duckdb/duckdb", "locator": "README → DuckDB / clients"}], "note": null},
      {"id": "duckdb-direct-file-querying", "text": "DuckDB can query CSV and Parquet files directly from SQL without requiring an explicit prior import into a separate server database.", "impact": "medium", "origin": "source", "status": "supported", "evidence": [{"kind": "primary_source", "source_id": "src-duckdb-repository-2026", "url": "https://github.com/duckdb/duckdb", "locator": "README → Data Import"}], "note": null},
      {"id": "duckdb-process-boundary", "text": "The core writable concurrency model is centered on a single process, so DuckDB's embedded simplicity should not be generalized into a universal client/server database replacement.", "impact": "high", "origin": "verification", "status": "supported", "evidence": [{"kind": "verification", "source_id": "src-duckdb-repository-2026", "url": "https://duckdb.org/docs/current/connect/concurrency", "locator": "Handling Concurrency → Single Process / Multiple Processes"}], "note": "DuckDB's newer Quack and DuckLake options are evolving; this claim describes the core embedded model rather than asserting that multi-process architectures are impossible."},
      {"id": "duckdb-postgres-boundary", "text": "DuckDB's in-process deployment model and PostgreSQL MVCC snapshots are different concepts even though both products use concurrency-control mechanisms.", "impact": "medium", "origin": "project_interpretation", "status": "supported", "evidence": [{"kind": "primary_source", "source_id": "src-duckdb-repository-2026", "url": "https://github.com/duckdb/duckdb", "locator": "README → in-process positioning"}, {"kind": "prior_insight", "insight_id": "postgresql-mvcc-snapshot-isolation", "locator": "MVCC snapshot/isolation model"}], "note": "This comparison is project synthesis and is not claimed by DuckDB or PostgreSQL documentation."}
    ]
  },
  "prerequisite_map": {
    "insight_id": "duckdb-in-process-analytics",
    "summary": "The mental model needs three pieces: the in-process deployment boundary, the embedded query-engine composition pattern, and direct file querying as one concrete leverage point.",
    "items": [
      {"id": "duckdb-prereq-in-process", "label": "In-process analytical database", "concept_id": "in-process-analytical-database", "priority": "must_know_now", "prior_coverage": "absent", "state": "explained_here", "reason": "Without the deployment boundary, DuckDB looks like just another SQL database rather than a different composition model.", "resolution": {"kind": "explained_here", "insight_id": "duckdb-in-process-analytics", "target": null}},
      {"id": "duckdb-prereq-embedded-query", "label": "Embedded query engine", "concept_id": "embedded-query-engine", "priority": "must_know_now", "prior_coverage": "absent", "state": "explained_here", "reason": "This concept explains how host application code invokes analytics directly instead of through a separate database-service hop.", "resolution": {"kind": "explained_here", "insight_id": "duckdb-in-process-analytics", "target": null}},
      {"id": "duckdb-prereq-direct-files", "label": "Direct file querying", "concept_id": "direct-file-querying", "priority": "learn_next", "prior_coverage": "absent", "state": "explained_here", "reason": "It is the most concrete example of how embedding can remove an intermediate ingestion boundary from a local data workflow.", "resolution": {"kind": "explained_here", "insight_id": "duckdb-in-process-analytics", "target": null}}
    ]
  },
  "learning_prompt": {
    "insight_id": "duckdb-in-process-analytics",
    "retention_prompt": "Without looking back, reconstruct the DuckDB architecture boundary: what does in-process mean, why does it change how a data tool is composed, how does direct file querying amplify that effect, and what workload boundary prevents the model from becoming a universal database rule?",
    "answer_key": {"problem_from": "whole_source_map.problem", "mechanism_from": "whole_source_map.thesis", "anchor_concept_ids": ["in-process-analytical-database", "embedded-query-engine", "direct-file-querying"], "boundary_limitation_index": 1},
    "transfer_prompt": {"prompt": "You are building a small local utility that receives CSV/Parquet extracts, runs repeatable joins/aggregations and exports a result. When is an embedded DuckDB engine a cleaner default than provisioning PostgreSQL, and what requirement would make you reconsider that boundary?", "expected_concept_ids": ["in-process-analytical-database", "embedded-query-engine", "direct-file-querying"]}
  },
  "source_decision": {
    "insight_id": "duckdb-in-process-analytics",
    "decision": "skim_selected_parts",
    "rationale": "The explainer captures the composition model, but the original repository README is worth a short skim for the breadth of clients and direct file examples, and the concurrency page is worth opening because it defines the most important deployment boundary. Reading the full repository is unnecessary for this mental model.",
    "novelty": {"level": "high", "reason": "The source introduces an in-process analytical deployment model that is not represented elsewhere in the current graph."},
    "source_quality": {"level": "high", "reason": "The primary source is the official DuckDB repository and the boundary evidence comes from official DuckDB documentation."},
    "relevance": {"level": "high", "reason": "Embedding analytical SQL can materially simplify local data utilities and transformation tools where a separate database service adds more friction than value."},
    "practical_leverage": {"level": "high", "reason": "The model can immediately change architecture choices for small data-processing applications and utilities."},
    "compression_loss": {"level": "medium", "reason": "The explainer intentionally omits the breadth of DuckDB clients/extensions and evolving concurrency options; those details are useful when choosing a concrete implementation."},
    "selected_parts": [
      {"label": "Repository README", "locator": "https://github.com/duckdb/duckdb#readme", "why": "See the official in-process positioning, language clients and direct CSV/Parquet examples."},
      {"label": "Concurrency", "locator": "https://duckdb.org/docs/current/connect/concurrency", "why": "Understand the process-centered read/write boundary and current multi-process options before choosing an architecture."}
    ]
  }
}
