{
  "contract_version":"1.0.0","intake_id":"intake-2026-08-27-github-pydantic-ai","insight_id":"pydantic-ai-typed-agent-contracts",
  "knowledge_delta":{"insight_id":"pydantic-ai-typed-agent-contracts","summary":"Pydantic AI adds a typed application-boundary model for agent outputs, dependencies, tools and behavioral evaluation. Existing ReAct/controlled-execution/history concepts are suppressed because typing is narrower than those reasoning or production-control responsibilities.","items":[
    {"relationship":"new","concept_id":"typed-agent-contract","label":"Typed agent contract","source_basis":"The repository emphasizes typed structured outputs and a typed agent API.","prior_basis":"Existing graph concepts describe reasoning, orchestration and governance but not a schema-validated application contract around an agent result.","interpretation":"Typing turns model output into an explicit runtime boundary for downstream code without claiming semantic correctness.","evidence_insights":[]},
    {"relationship":"new","concept_id":"run-context-dependency-injection","label":"RunContext dependency injection","source_basis":"RunContext carries typed dependencies into tools/instructions during an agent run.","prior_basis":"The graph has execution/runtime concepts but no general agent-application concept for explicit typed dependency injection.","interpretation":"Runtime services and context become inspectable application dependencies rather than hidden global state.","evidence_insights":[]},
    {"relationship":"new","concept_id":"validated-tool-boundary","label":"Validated tool boundary","source_basis":"Tool signatures/docstrings form schemas and arguments are validated before tool code runs.","prior_basis":"Existing controlled-execution concepts govern consequential work more broadly; they do not represent this code-level schema boundary.","interpretation":"Tool validation reduces structural interface errors but does not supply authorization or side-effect safety by itself.","evidence_insights":[]},
    {"relationship":"new","concept_id":"agent-evaluation-surface","label":"Agent evaluation surface","source_basis":"The repository positions Pydantic Evals as a dedicated way to test agent behavior, alongside OpenTelemetry instrumentation.","prior_basis":"Replayable evaluation in the existing graph is specifically historical execution replay and should not be reused for a generic eval framework.","interpretation":"Behavioral evaluation remains a separate quality layer after type correctness is established.","evidence_insights":[]}
  ],"suppressed_prior_matches":["controlled-execution","react-loop","replayable-evaluation","execution-history","human-agent-task-equivalence"]},
  "claim_evidence":{"insight_id":"pydantic-ai-typed-agent-contracts","claims":[
    {"id":"pydantic-typed-agent-loop","text":"Pydantic AI positions its core as a typed extensible agent loop with typed structured outputs and dependencies.","impact":"high","origin":"source","status":"supported","evidence":[{"kind":"primary_source","source_id":"src-pydantic-ai-repository-2026","url":"https://github.com/pydantic/pydantic-ai","locator":"README → opening product definition / Why Pydantic AI"}],"note":null},
    {"id":"pydantic-tool-validation","text":"Pydantic AI derives tool schemas from Python functions and validates tool arguments before application tool code runs.","impact":"high","origin":"source","status":"supported","evidence":[{"kind":"primary_source","source_id":"src-pydantic-ai-repository-2026","url":"https://github.com/pydantic/pydantic-ai","locator":"README → Data extraction / @agent.tool"}],"note":null},
    {"id":"pydantic-runcontext-dependencies","text":"RunContext carries typed runtime dependencies into agent tools and instructions during execution.","impact":"medium","origin":"source","status":"supported","evidence":[{"kind":"primary_source","source_id":"src-pydantic-ai-repository-2026","url":"https://github.com/pydantic/pydantic-ai","locator":"README → Data extraction / RunContext"}],"note":null},
    {"id":"pydantic-evals-separate-quality-layer","text":"Pydantic AI exposes evaluation and instrumentation as separate quality/observability surfaces rather than treating typed output as evidence that agent behavior is correct.","impact":"high","origin":"project_interpretation","status":"supported","evidence":[{"kind":"primary_source","source_id":"src-pydantic-ai-repository-2026","url":"https://github.com/pydantic/pydantic-ai","locator":"README → Why Pydantic AI → Measured, not vibes"}],"note":"This is the project's architecture interpretation of the repository's separate typing, instrumentation and eval surfaces."}
  ]},
  "prerequisite_map":{"insight_id":"pydantic-ai-typed-agent-contracts","summary":"The model needs four related boundaries: typed result contracts, explicit RunContext dependencies, validated tools and a separate behavioral evaluation surface.","items":[
    {"id":"pydantic-prereq-contract","label":"Typed agent contract","concept_id":"typed-agent-contract","priority":"must_know_now","prior_coverage":"absent","state":"explained_here","reason":"The central value disappears if typed output is treated as only developer ergonomics rather than a runtime application boundary.","resolution":{"kind":"explained_here","insight_id":"pydantic-ai-typed-agent-contracts","target":null}},
    {"id":"pydantic-prereq-context","label":"RunContext dependency injection","concept_id":"run-context-dependency-injection","priority":"must_know_now","prior_coverage":"absent","state":"explained_here","reason":"Explicit dependencies explain how tools receive application services and data without hiding them in global state or prompts.","resolution":{"kind":"explained_here","insight_id":"pydantic-ai-typed-agent-contracts","target":null}},
    {"id":"pydantic-prereq-tool","label":"Validated tool boundary","concept_id":"validated-tool-boundary","priority":"must_know_now","prior_coverage":"absent","state":"explained_here","reason":"Tool schema validation is the concrete boundary where model-generated arguments enter application code.","resolution":{"kind":"explained_here","insight_id":"pydantic-ai-typed-agent-contracts","target":null}},
    {"id":"pydantic-prereq-evals","label":"Agent evaluation surface","concept_id":"agent-evaluation-surface","priority":"learn_next","prior_coverage":"absent","state":"explained_here","reason":"Type correctness cannot establish behavioral quality, so a separate eval surface is needed to complete the model.","resolution":{"kind":"explained_here","insight_id":"pydantic-ai-typed-agent-contracts","target":null}}
  ]},
  "learning_prompt":{"insight_id":"pydantic-ai-typed-agent-contracts","retention_prompt":"Without looking back, reconstruct the Pydantic AI application boundary: what becomes typed, how RunContext carries dependencies, what is validated before a tool runs, and which production/quality concerns still require separate controls or evals?","answer_key":{"problem_from":"whole_source_map.problem","mechanism_from":"whole_source_map.thesis","anchor_concept_ids":["typed-agent-contract","run-context-dependency-injection","validated-tool-boundary"],"boundary_limitation_index":0},"transfer_prompt":{"prompt":"An agent prepares a customer update using a typed output model and a typed tool. Which failures can those contracts prevent, what belongs in RunContext, and which authorization or side-effect controls must still live outside this typed SDK boundary?","expected_concept_ids":["typed-agent-contract","run-context-dependency-injection","validated-tool-boundary"]}},
  "source_decision":{"insight_id":"pydantic-ai-typed-agent-contracts","decision":"skim_selected_parts","rationale":"The explainer preserves the typed-boundary mental model, but the README examples are worth a targeted skim because they show output_type, RunContext and tool validation in a small amount of code. Provider/capability catalogs are not required for the current goal.","novelty":{"level":"high","reason":"The source adds explicit typed agent-application boundaries not represented as standalone concepts in the current graph."},"source_quality":{"level":"high","reason":"The official repository is the primary source for the framework's API/positioning and is version-bounded to v2.35.1."},"relevance":{"level":"high","reason":"Typed outputs, dependencies and tools are directly applicable to building reliable Python agent applications."},"practical_leverage":{"level":"high","reason":"The model can immediately change how agent tools and downstream result handling are implemented."},"compression_loss":{"level":"medium","reason":"The core model compresses well, but the short code examples are useful for seeing exactly where validation and RunContext enter execution."},"selected_parts":[
    {"label":"Typed loop and positioning","locator":"README → opening product definition / Why Pydantic AI","why":"Establishes typed end-to-end as the framework's core application boundary.","claim_refs":["pydantic-typed-agent-loop"]},
    {"label":"Data extraction example","locator":"README → Data extraction / @agent.tool","why":"Shows output_type and tool schema validation in executable form.","claim_refs":["pydantic-tool-validation"]},
    {"label":"RunContext dependencies","locator":"README → Data extraction / RunContext","why":"Shows how runtime dependencies enter tools without being hidden global state.","claim_refs":["pydantic-runcontext-dependencies"]}
  ]}
}
